[
  {
    "event_id": "a789b7fa-ec4c-44a1-9b14-5b08dd90e3f1",
    "story_id": "62aad4a5-2cd4-5675-9200-2fda5e739b69",
    "timestamp": "2026-10-01T15:28:31.098592Z",
    "event_type": "input_submitted",
    "before": null,
    "after": {
      "n": "Linlin",
      "f": "Pink Hydrangea",
      "i": "karna itu menggambarkan sosoknya yang lembut dan perhatian akan perasaan orang lain. peka terhadap kebagiaan yang orang lain rasakan. dan sangat menghargai kebaikan orang lain kepadanya."
    },
    "metadata": {
      "source": "conversation",
      "command": "/input"
    }
  },
  {
    "event_id": "944cb622-dae0-4d3f-836f-52c094f116d3",
    "story_id": "62aad4a5-2cd4-5675-9200-2fda5e739b69",
    "timestamp": "2026-10-01T15:28:31.098592Z",
    "event_type": "generation_created",
    "before": null,
    "after": {
      "level": 0,
      "status": "generated",
      "output": {
        "inspiration": "The Pink Hydrangea.\n\nLinlin memilih Pink Hydrangea karena bunga ini terasa seperti gambaran dari sosoknya sendiri—lembut, penuh perhatian, dan peka terhadap perasaan orang lain.\n\nAda kebahagiaan yang ia temukan ketika melihat orang lain merasa bahagia. Perasaan orang lain bukan sesuatu yang mudah ia abaikan; ia mampu memperhatikannya dan ikut merasakan hangatnya kebahagiaan yang mereka miliki.\n\nDi balik kelembutan itu, ada pula sesuatu yang ia pegang erat: penghargaan terhadap kebaikan.\n\nIa menghargai orang-orang yang telah memperlakukannya dengan baik, sekecil apa pun kebaikan tersebut. Bagi Linlin, perhatian bukan hanya tentang memberi, tetapi juga tentang mampu menyadari dan menghargai ketika seseorang telah memberikan sesuatu dengan tulus.\n\nMungkin karena itu Pink Hydrangea terasa begitu dekat dengannya.\n\nLembut dalam memperlakukan, peka dalam merasakan, dan tulus dalam menghargai kebaikan orang lain."
      },
      "maturity": {
        "mr": "absent",
        "i": "raw"
      }
    },
    "metadata": {
      "source": "conversation",
      "command": "/input",
      "note": "AI-generated output awaiting Gardener validation where applicable"
    }
  }
]