[
  {
    "event_id": "469d7d9c-5ff4-46a7-a0c7-daeced973c76",
    "story_id": "3c761ad5-d058-54d2-8a16-88e76c83d7dc",
    "timestamp": "2026-10-01T15:28:31.098592Z",
    "event_type": "input_submitted",
    "before": null,
    "after": {
      "n": "Arka",
      "f": "Violet",
      "mr": "Aku memilih violet karna bukan semata tentang paras yang mampu membuat mata enggan berpaling, melainkan tentang bagaimana kehadirannya membuat dunia seakan menemukan warna yang selama ini hilang. Ada sesuatu dalam dirinya yang tak mampu dijelaskan hanya dengan kata indah, sebab keindahan terkadang bukan sesuatu yang dapat dipandang, melainkan sesuatu yang perlahan menetap di dalam hati. Violet bagiku bukan sekadar bunga yang mekar di antara ribuan taman, ia adalah alasan mengapa aku percaya bahwa sesuatu yang sederhana pun dapat terasa begitu sempurna ketika hadir di waktu yang tepat. *karna sejatinya kecantikan itu relatif, akan tetapi kesempurnaan itu bernama Violet",
      "i": "Terinspirasi dari anime Violet Evergarden, yang membuat Violet memiliki hubungan emosional baginya. Seseorang yang membuat dunia menemukan kembali warna yang hilang."
    },
    "metadata": {
      "source": "conversation",
      "command": "/input"
    }
  },
  {
    "event_id": "4811f19b-7388-481b-83ca-82a85512747b",
    "story_id": "3c761ad5-d058-54d2-8a16-88e76c83d7dc",
    "timestamp": "2026-10-01T15:28:31.098592Z",
    "event_type": "generation_created",
    "before": null,
    "after": {
      "level": 1,
      "status": "generated",
      "output": {
        "meaning_reason": "Aku memilih violet karna bukan semata tentang paras yang mampu membuat mata enggan berpaling, melainkan tentang bagaimana kehadirannya membuat dunia seakan menemukan warna yang selama ini hilang. Ada sesuatu dalam dirinya yang tak mampu dijelaskan hanya dengan kata indah, sebab keindahan terkadang bukan sesuatu yang dapat dipandang, melainkan sesuatu yang perlahan menetap di dalam hati. Violet bagiku bukan sekadar bunga yang mekar di antara ribuan taman, ia adalah alasan mengapa aku percaya bahwa sesuatu yang sederhana pun dapat terasa begitu sempurna ketika hadir di waktu yang tepat. *karna sejatinya kecantikan itu relatif, akan tetapi kesempurnaan itu bernama Violet",
        "inspiration": "The Violet.\n\nArka mengenal Violet melalui Violet Evergarden—sebuah pertemuan yang tidak berhenti pada sekadar nama bunga, tetapi berkembang menjadi hubungan emosional dengan sosok bernama Violet.\n\nDari sana, bunga ini memperoleh makna yang lebih personal. Violet bukan hanya sesuatu yang indah untuk dipandang, tetapi sesuatu yang mampu membuat dunia terasa menemukan kembali warna yang pernah hilang.\n\nAda keindahan yang tidak selesai ketika mata memandangnya. Ia justru mulai bekerja setelahnya, perlahan menetap di dalam hati dan membuat sesuatu yang sederhana terasa memiliki arti yang jauh lebih besar.\n\nMungkin karena itulah Violet terasa begitu dekat bagi Arka.\n\nBukan hanya karena ia indah, tetapi karena ia membawa kembali sesuatu yang pernah terasa hilang.\n\nTerkadang, satu sosok, satu nama, atau satu bunga dapat hadir pada waktu yang tepat dan membuat dunia terasa sedikit lebih berwarna."
      },
      "maturity": {
        "mr": "mature",
        "i": "raw"
      }
    },
    "metadata": {
      "source": "conversation",
      "command": "/input",
      "note": "AI-generated output awaiting Gardener validation where applicable"
    }
  }
]