[
  {
    "event_id": "e9eff3d3-8174-4cf9-a4e1-7f10f0ff9045",
    "story_id": "3b86e622-e223-5f72-968a-af117f1520e9",
    "timestamp": "2026-10-01T15:28:31.098592Z",
    "event_type": "input_submitted",
    "before": null,
    "after": {
      "n": "Alip",
      "f": "Blue Lotus",
      "mr": "Aku mau jadi blue lotus, karena cara ia hidup terasa seperti cerminan diriku. Akarnya tertanam jauh di dasar lumpur, seolah mengingatkanku untuk nggak melupakan dari mana aku berasal. Batangnya tumbuh menembus air, perlahan mencari permukaan, seperti perjalanan yang nggak selalu mudah tapi tetap punya arah. Lalu bunganya mekar di atas air, sementara kelopaknya yang biru terasa seperti simbol ketenangan dan kedalaman. Ia hidup di ekosistem yang penuh kehidupan, tapi tetap punya ruang untuk mekar dengan caranya sendiri. Mungkin aku juga begitu; dibentuk oleh hal-hal yang nggak selalu indah, membawa masa lalu sebagai akar, melewati keruhnya perjalanan sebagai batang, lalu terus mencari cahaya. Karena pada akhirnya, aku nggak ingin menjadi seseorang yang mekar karena hidupnya selalu bersih dari lumpur. Aku ingin menjadi blue lotus—yang pernah berakar di dalam gelap, pernah melewati air yang keruh, tapi tetap memilih mengangkat wajahnya ke cahaya dan mekar dengan tenang.",
      "i": "Terinspirasi oleh harapan untuk selalu mampu melewati kehidupan yang tidak selalu indah atau baik kepadanya. Ada rasa bangga karena sudah sampai sejauh ini dan harapan untuk terus melangkah. Tetap mekar, tetap berjalan, dan berharap bisa menjadi lebih kuat dari hari ini."
    },
    "metadata": {
      "source": "conversation",
      "command": "/input"
    }
  },
  {
    "event_id": "61869f07-b75b-4197-ac16-ff08b6e15f25",
    "story_id": "3b86e622-e223-5f72-968a-af117f1520e9",
    "timestamp": "2026-10-01T15:28:31.098592Z",
    "event_type": "generation_created",
    "before": null,
    "after": {
      "level": 1,
      "status": "generated",
      "output": {
        "meaning_reason": "Aku mau jadi blue lotus, karena cara ia hidup terasa seperti cerminan diriku. Akarnya tertanam jauh di dasar lumpur, seolah mengingatkanku untuk nggak melupakan dari mana aku berasal. Batangnya tumbuh menembus air, perlahan mencari permukaan, seperti perjalanan yang nggak selalu mudah tapi tetap punya arah. Lalu bunganya mekar di atas air, sementara kelopaknya yang biru terasa seperti simbol ketenangan dan kedalaman. Ia hidup di ekosistem yang penuh kehidupan, tapi tetap punya ruang untuk mekar dengan caranya sendiri. Mungkin aku juga begitu; dibentuk oleh hal-hal yang nggak selalu indah, membawa masa lalu sebagai akar, melewati keruhnya perjalanan sebagai batang, lalu terus mencari cahaya. Karena pada akhirnya, aku nggak ingin menjadi seseorang yang mekar karena hidupnya selalu bersih dari lumpur. Aku ingin menjadi blue lotus—yang pernah berakar di dalam gelap, pernah melewati air yang keruh, tapi tetap memilih mengangkat wajahnya ke cahaya dan mekar dengan tenang.",
        "inspiration": "aku memilih bunga ini karna aku ingin terus mengingat bahwa hidup tidak selalu harus indah atau baik kepadaku untuk tetap memiliki alasan untuk melangkah. Ada rasa bangga karena aku sudah sampai sejauh ini, melewati hal-hal yang tidak selalu mudah, dan masih memiliki harapan untuk menjadi lebih kuat dari hari ini.\n\nBlue lotus mengingatkanku bahwa mekar bukan berarti tidak pernah mengenal lumpur. Ada masa lalu yang menjadi akar, ada perjalanan yang harus dilewati, dan ada cahaya yang tetap dicari meskipun jalannya tidak selalu terang.\n\nMungkin aku tidak bisa memilih seperti apa kehidupan akan memperlakukanku, tetapi aku masih bisa memilih untuk terus berjalan. Tetap mekar, tetap berharap, dan perlahan menjadi seseorang yang lebih kuat tanpa harus melupakan dari mana aku berasal."
      },
      "maturity": {
        "mr": "mature",
        "i": "raw"
      }
    },
    "metadata": {
      "source": "conversation",
      "command": "/input",
      "note": "AI-generated output awaiting Gardener validation where applicable"
    }
  }
]