[
  {
    "event_id": "e9c0617c-9a90-456f-a856-2e6056ef5e28",
    "story_id": "c3fec366-bf53-565f-9b19-c3d1a764ac03",
    "timestamp": "2026-10-01T15:35:28.837189Z",
    "event_type": "input_submitted",
    "before": null,
    "after": {
      "n": "Beeya",
      "f": "Common Sunflower"
    },
    "metadata": {
      "source": "conversation",
      "command": "/input"
    }
  },
  {
    "event_id": "633a9db6-131f-4a95-a685-ba51786ce6e8",
    "story_id": "c3fec366-bf53-565f-9b19-c3d1a764ac03",
    "timestamp": "2026-10-01T15:35:28.837189Z",
    "event_type": "generation_created",
    "before": null,
    "after": {
      "level": 0,
      "status": "generated",
      "output": {
        "inspiration": "aku memilih bunga ini karna untuk saat ini Common Sunflower terasa menarik melalui kesan yang sederhana: terang, hangat, dan mudah membuat perhatian berhenti sejenak.\n\nAda sesuatu dari bunga matahari yang terasa dekat dengan gagasan tentang tumbuh dan terus mencari cahaya. Ia dapat menjadi gambaran tentang harapan, semangat, atau keinginan untuk tetap bergerak ke arah yang lebih baik—meskipun belum tentu itulah alasan sebenarnya Beeya memilihnya.\n\nMungkin nantinya akan ditemukan cerita yang lebih personal di balik pilihan ini. Bisa jadi tentang warna kuningnya, bentuknya, kenangan tertentu, seseorang, atau sekadar rasa suka ketika pertama kali melihatnya. Untuk sekarang, biarkan Common Sunflower menjadi awal dari sebuah pertanyaan: apa yang membuat bunga yang selalu tampak menghadap cahaya ini terasa dekat bagi Beeya?"
      },
      "maturity": {
        "mr": "absent",
        "i": "raw"
      }
    },
    "metadata": {
      "source": "conversation",
      "command": "/input",
      "note": "AI-generated raw inspiration awaiting Gardener input and validation"
    }
  },
  {
    "event_id": "0ee873d9-25b6-4aab-bbcd-4e918aa49384",
    "story_id": "c3fec366-bf53-565f-9b19-c3d1a764ac03",
    "timestamp": "2026-10-01T18:19:49.480453Z",
    "event_type": "input_updated",
    "before": {
      "i": null
    },
    "after": {
      "i": "kuning memberikan kesan kebahagiaan. bunga matahari juga di simbolkan sebagai kesetiaan, karna selalu menghadap kemana arah matahari. dan juga sering lihat di film2 dan terfokus pada karakter wanita yang memakai gaun/pakaian berwarna kuning, seakan warna kuning ada sesuatu yang menarik. juga dalam percintaan, warna kuning itu bermakna kehangatan, keceriaan, optimis, keterbukaan emosional."
    },
    "metadata": {
      "source": "conversation",
      "command": "/update",
      "maturity": "raw",
      "note": "Gardener-provided raw inspiration stored; AI inspiration regenerated from updated input."
    }
  },
  {
    "event_id": "cb5348f1-fc07-4f85-b2af-97bca8626bde",
    "story_id": "c3fec366-bf53-565f-9b19-c3d1a764ac03",
    "timestamp": "2026-10-01T18:19:49.480453Z",
    "event_type": "generation_created",
    "before": null,
    "after": {
      "level": 0,
      "status": "generated",
      "output": {
        "inspiration": "aku memilih bunga ini karna warna kuningnya memberikan kesan kebahagiaan, hangat, dan ceria.\n\nAda sesuatu dari warna kuning yang selalu terasa menarik bagi Beeya. Ia sering menemukannya dalam film, terutama ketika warna itu hadir pada pakaian atau gaun seorang perempuan dan tanpa sadar membuat perhatiannya berhenti lebih lama. Seolah-olah kuning memiliki daya tarik tersendiri—sederhana, tetapi mampu membuat sesuatu terasa lebih hidup.\n\nBunga matahari kemudian membawa kesan itu ke dalam bentuk yang lebih utuh. Ia sering dikaitkan dengan kesetiaan karena dikenal menghadap ke arah datangnya cahaya matahari. Di sisi lain, warna kuning juga terasa dekat dengan kehangatan, keceriaan, optimisme, dan keterbukaan emosional, terutama ketika berbicara tentang hubungan dan perasaan.\n\nMungkin itulah yang membuat Common Sunflower terasa dekat bagi Beeya. Bukan hanya karena bunganya terlihat cerah, tetapi karena warna dan simbol yang dibawanya seakan memiliki sesuatu yang ingin disampaikan: tentang rasa hangat, ketertarikan, kesetiaan, dan keberanian untuk tetap terbuka terhadap perasaan."
      },
      "maturity": {
        "mr": "absent",
        "i": "raw"
      }
    },
    "metadata": {
      "source": "conversation",
      "command": "/update",
      "note": "AI-generated inspiration updated from Gardener raw input."
    }
  }
]
