[
  {
    "event_id": "d8d61859-9b1e-4902-98ca-fc09ebf88d40",
    "story_id": "6365ef26-8537-5ebf-9876-68ebcd6372b4",
    "timestamp": "2026-10-01T15:28:31.098592Z",
    "event_type": "input_submitted",
    "before": null,
    "after": {
      "n": "Sarah",
      "f": "Stargazer Lily",
      "mr": "Aku ingin menjadi pink lily, agar hatiku selalu tahu cara menyayangi dengan lembut. Dan aku ingin menjadi white lily, agar setiap rasa yang tumbuh tetap tulus dan damai. Semoga aku mekar tanpa kehilangan kelembutan, dan mencintai tanpa kehilangan ketulusan.",
      "i": "Awalnya bukan karena makna. Ia melihat visualnya cantik. Setelah memilihnya, ia mengetahui makna pink + white lily dan merasa dekat dengan makna tersebut. Menemukan keindahan terlebih dahulu, lalu menemukan makna di baliknya."
    },
    "metadata": {
      "source": "conversation",
      "command": "/input"
    }
  },
  {
    "event_id": "9a2606f2-5dca-41bd-abb4-3e5439065ade",
    "story_id": "6365ef26-8537-5ebf-9876-68ebcd6372b4",
    "timestamp": "2026-10-01T15:28:31.098592Z",
    "event_type": "generation_created",
    "before": null,
    "after": {
      "level": 0,
      "status": "generated",
      "output": {
        "meaning_reason": "Aku ingin menjadi pink lily, agar hatiku selalu tahu cara menyayangi dengan lembut. Dan aku ingin menjadi white lily, agar setiap rasa yang tumbuh tetap tulus dan damai. Semoga aku mekar tanpa kehilangan kelembutan, dan mencintai tanpa kehilangan ketulusan.",
        "inspiration": "The Stargazer Lily.\n\nSarah pertama kali memilih Stargazer Lily bukan karena mengetahui maknanya, melainkan karena ia melihat sesuatu yang indah.\n\nIa tertarik pada visualnya terlebih dahulu. Tidak ada makna khusus yang sedang ia cari ketika memilihnya—hanya ada sebuah bunga yang menurutnya cantik, lalu membuatnya ingin berhenti dan melihat lebih dekat.\n\nSetelah pilihan itu dibuat, barulah ia menemukan makna yang ada di baliknya.\n\nPink mengingatkannya pada kelembutan dalam menyayangi, sementara putih membawa gagasan tentang ketulusan dan kedamaian. Makna-makna itu kemudian terasa dekat dengan sesuatu yang ingin ia bawa dalam dirinya.\n\nMungkin memang tidak semua hal harus dimulai dari sebuah alasan.\n\nTerkadang, kita menemukan sesuatu karena keindahannya terlebih dahulu. Lalu, setelah memilihnya, kita menemukan alasan mengapa ia terasa begitu dekat."
      },
      "maturity": {
        "mr": "raw",
        "i": "raw"
      }
    },
    "metadata": {
      "source": "conversation",
      "command": "/input",
      "note": "AI-generated output awaiting Gardener validation where applicable"
    }
  }
]