[
  {
    "event_id": "c001d8ae-fc54-4b65-a8b5-b73369f1bf65",
    "story_id": "22999309-b904-5f36-be14-2c82ad442aac",
    "timestamp": "2026-10-01T15:28:31.098592Z",
    "event_type": "input_submitted",
    "before": null,
    "after": {
      "n": "Ifvynn",
      "f": "Bearded Iris",
      "i": "karna bunga iris menjadi symbol bangsawan, punya keterikatan dengan keluarga bangsawan di Eropa. kebijaksanaan, keberanian."
    },
    "metadata": {
      "source": "conversation",
      "command": "/input"
    }
  },
  {
    "event_id": "b5290639-3a45-4919-b6e7-f4dd3f48dd54",
    "story_id": "22999309-b904-5f36-be14-2c82ad442aac",
    "timestamp": "2026-10-01T15:28:31.098592Z",
    "event_type": "generation_created",
    "before": null,
    "after": {
      "level": 0,
      "status": "generated",
      "output": {
        "inspiration": "The Bearded Iris.\n\nIfvynn memilih Bearded Iris karena bunga ini membawa kesan yang berkaitan dengan kebangsawanan dan sejarah keluarga kerajaan di Eropa.\n\nDari keterkaitan tersebut, muncul pula nilai yang terasa dekat dengannya: kebijaksanaan dan keberanian.\n\nAda sesuatu yang menarik dari bunga yang tidak hanya dipandang karena keindahannya, tetapi juga karena simbol dan sejarah yang melekat di belakangnya. Bearded Iris terasa seperti bunga yang membawa karakter—anggun, berwibawa, namun tetap menyimpan keteguhan.\n\nMungkin itulah yang membuatnya menarik bagi Ifvynn: bukan sekadar bagaimana bunga itu terlihat, tetapi apa yang terasa hadir di baliknya.\n\nKeanggunan yang membawa sejarah, kebijaksanaan yang lahir dari pengalaman, dan keberanian untuk berdiri dengan martabatnya sendiri."
      },
      "maturity": {
        "mr": "absent",
        "i": "raw"
      }
    },
    "metadata": {
      "source": "conversation",
      "command": "/input",
      "note": "AI-generated output awaiting Gardener validation where applicable"
    }
  }
]